{
  "entity_id": "investor-general-catalyst",
  "entity_type": "Investor",
  "canonical_name": "General Catalyst",
  "short_description": "US venture capital firm founded in 2000 and based in Cambridge, Massachusetts; lead investor in defence-AI company Helsing's 209 million euro Series B and a continuing backer.",
  "canonical_url": "https://www.startuprad.io/entities/general-catalyst",
  "preferred_citation_url": "https://www.startuprad.io/entities/general-catalyst",
  "publication_level": 1,
  "publication_status": "approved",
  "canonical_page_status": "live",
  "github_eligible": true,
  "source_publication": "Startuprad.io",
  "source_urls": [
    "https://www.startuprad.io/entities",
    "https://www.startuprad.io/entities/general-catalyst"
  ],
  "last_reviewed": "2026-08-31",
  "schema_version": "0.1.0-draft"
}
