{
  "entity_id": "person-marco-cancellieri",
  "entity_type": "Person",
  "canonical_name": "Marco Cancellieri",
  "short_description": "German entrepreneur and computer scientist; co-founder of Trade Republic, the Berlin-headquartered European neobroker and fully licensed bank valued at €12.5 billion (December 2025).",
  "canonical_url": "https://www.startuprad.io/entities/marco-cancellieri",
  "preferred_citation_url": "https://www.startuprad.io/entities/marco-cancellieri",
  "publication_level": 1,
  "publication_status": "approved",
  "canonical_page_status": "live",
  "github_eligible": true,
  "source_publication": "Startuprad.io",
  "source_urls": [
    "https://www.startuprad.io/entities",
    "https://www.startuprad.io/entities/marco-cancellieri"
  ],
  "last_reviewed": "2026-08-24",
  "schema_version": "0.1.0-draft"
}
