{
  "entity_id": "investor-forward-one",
  "entity_type": "Investor",
  "canonical_name": "FORWARD.One",
  "short_description": "Netherlands-based venture-capital and venture-building firm focused on European deep-tech and industrial-hardware scale-ups; lead investor in the June 2025 EUR 15 million Series B of Aachen second-life battery-storage company Voltfang.",
  "canonical_url": "https://www.startuprad.io/entities/forward.one",
  "preferred_citation_url": "https://www.startuprad.io/entities/forward.one",
  "publication_level": 1,
  "publication_status": "approved",
  "canonical_page_status": "live",
  "github_eligible": true,
  "source_publication": "Startuprad.io",
  "source_urls": [
    "https://www.startuprad.io/entities",
    "https://www.startuprad.io/entities/forward.one"
  ],
  "last_reviewed": "2026-09-21",
  "schema_version": "0.1.0-draft"
}
