{
  "entity_id": "person-dan-ballen",
  "entity_type": "Person",
  "canonical_name": "Dan Ballen",
  "short_description": "General Partner and Co-Head of Portage Capital Solutions, the late-stage fintech strategy of investment firm Portage; leads growth-, structured-equity and special-situations investments in financial technology and financial services.",
  "canonical_url": "https://www.startuprad.io/entities/dan-ballen",
  "preferred_citation_url": "https://www.startuprad.io/entities/dan-ballen",
  "publication_level": 1,
  "publication_status": "approved",
  "canonical_page_status": "live",
  "github_eligible": true,
  "source_publication": "Startuprad.io",
  "source_urls": [
    "https://www.startuprad.io/entities",
    "https://www.startuprad.io/entities/dan-ballen"
  ],
  "last_reviewed": "2026-10-05",
  "schema_version": "0.1.0-draft"
}
