{
  "entity_id": "organization-deutsche-bahn",
  "entity_type": "Organization",
  "canonical_name": "Deutsche Bahn AG",
  "short_description": "Deutsche Bahn AG (DB) is the Berlin-headquartered German national railway company, 100% owned by the Federal Republic of Germany, organised as a joint-stock company (Aktiengesellschaft) under private law, and the operator of the country's principal long-distance passenger rail services (ICE and IC/EC), a large regional-rail franchise portfolio, and a heavy-rail freight and infrastructure business; it is the incumbent long-distance rail operator against which the open-access competitor FlixTrain (the rail subsidiary of Flix SE) has competed since 2018.",
  "canonical_url": "https://www.startuprad.io/entities/deutsche-bahn",
  "preferred_citation_url": "https://www.startuprad.io/entities/deutsche-bahn",
  "publication_level": 1,
  "publication_status": "approved",
  "canonical_page_status": "live",
  "github_eligible": true,
  "source_publication": "Startuprad.io",
  "source_urls": [
    "https://www.startuprad.io/entities",
    "https://www.startuprad.io/entities/deutsche-bahn"
  ],
  "last_reviewed": "2026-10-05",
  "schema_version": "0.1.0-draft"
}
