{
  "entity_id": "investor-allianz-x",
  "entity_type": "Investor",
  "canonical_name": "Allianz X",
  "short_description": "Allianz X is the digital investment unit of Allianz and a co-lead investor in mobile bank N26.",
  "canonical_url": "https://www.startuprad.io/entities/allianz-x",
  "preferred_citation_url": "https://www.startuprad.io/entities/allianz-x",
  "publication_level": 1,
  "publication_status": "approved",
  "canonical_page_status": "live",
  "github_eligible": true,
  "source_publication": "Startuprad.io",
  "source_urls": [
    "https://www.startuprad.io/entities",
    "https://www.startuprad.io/entities/allianz-x"
  ],
  "last_reviewed": "2026-10-05",
  "schema_version": "0.1.0-draft"
}
