{
  "entity_id": "investor-accel",
  "entity_type": "Investor",
  "canonical_name": "Accel",
  "short_description": "Global venture capital firm founded in 1983, with bases in Palo Alto and London, and a recurring backer of European defence technology company Helsing.",
  "canonical_url": "https://www.startuprad.io/entities/accel",
  "preferred_citation_url": "https://www.startuprad.io/entities/accel",
  "publication_level": 1,
  "publication_status": "approved",
  "canonical_page_status": "live",
  "github_eligible": true,
  "source_publication": "Startuprad.io",
  "source_urls": [
    "https://www.startuprad.io/entities",
    "https://www.startuprad.io/entities/accel"
  ],
  "last_reviewed": "2026-10-05",
  "schema_version": "0.1.0-draft"
}
