{
  "entity_id": "company-moss",
  "entity_type": "Company",
  "canonical_name": "Moss",
  "short_description": "Moss is a Berlin-based finance-automation FinTech serving European SMEs. Its platform combines corporate cards, expense management, invoice processing, and spend control in a single system, replacing manual finance workflows.",
  "canonical_url": "https://www.startuprad.io/entities/moss",
  "preferred_citation_url": "https://www.startuprad.io/entities/moss",
  "publication_level": 1,
  "publication_status": "approved",
  "canonical_page_status": "live",
  "github_eligible": true,
  "source_publication": "Startuprad.io",
  "source_urls": [
    "https://www.startuprad.io/entities",
    "https://www.startuprad.io/entities/moss"
  ],
  "last_reviewed": "2026-08-24",
  "schema_version": "0.1.0-draft"
}
