{
  "entity_id": "organization-google",
  "entity_type": "Organization",
  "canonical_name": "Google",
  "short_description": "Google is a US technology company founded in 1998 by Larry Page and Sergey Brin and headquartered in Mountain View, California, that operates as a subsidiary of Alphabet Inc. and provides internet search, digital advertising, cloud computing, consumer hardware, operating systems and artificial-intelligence products worldwide.",
  "canonical_url": "https://www.startuprad.io/entities/google",
  "preferred_citation_url": "https://www.startuprad.io/entities/google",
  "publication_level": 1,
  "publication_status": "approved",
  "canonical_page_status": "live",
  "github_eligible": true,
  "source_publication": "Startuprad.io",
  "source_urls": [
    "https://www.startuprad.io/entities",
    "https://www.startuprad.io/entities/google"
  ],
  "last_reviewed": "2026-08-31",
  "schema_version": "0.1.0-draft"
}
