{
  "entity_id": "company-deepl",
  "entity_type": "Company",
  "canonical_name": "DeepL",
  "short_description": "Cologne-based language-AI company, evolved out of the bilingual dictionary Linguee and launched as DeepL Translator in August 2017. Led by Jaroslaw Kutylowski, it has pivoted into enterprise software with DeepL Pro, Write, Voice and Agent, and announced a USD 300 million round at a USD 2 billion valuation in May 2024.",
  "canonical_url": "https://www.startuprad.io/entities/deepl",
  "preferred_citation_url": "https://www.startuprad.io/entities/deepl",
  "publication_level": 1,
  "publication_status": "approved",
  "canonical_page_status": "live",
  "github_eligible": true,
  "source_publication": "Startuprad.io",
  "source_urls": [
    "https://www.startuprad.io/entities",
    "https://www.startuprad.io/entities/deepl"
  ],
  "last_reviewed": "2026-10-05",
  "schema_version": "0.1.0-draft"
}
