{
  "entity_id": "investor-dragoneer",
  "entity_type": "Investor",
  "canonical_name": "Dragoneer Investment Group",
  "short_description": "Dragoneer Investment Group is a San Francisco growth-oriented investment firm founded in 2012 by Marc Stad that joined N26's 2021 Series E round.",
  "canonical_url": "https://www.startuprad.io/entities/dragoneer",
  "preferred_citation_url": "https://www.startuprad.io/entities/dragoneer",
  "publication_level": 1,
  "publication_status": "approved",
  "canonical_page_status": "live",
  "github_eligible": true,
  "source_publication": "Startuprad.io",
  "source_urls": [
    "https://www.startuprad.io/entities",
    "https://www.startuprad.io/entities/dragoneer"
  ],
  "last_reviewed": "2026-10-05",
  "schema_version": "0.1.0-draft"
}
